{
  "$schema": "https://json-schema.org/draft/2020-12/schema",
  "title": "decision",
  "description": "A decision record (BRIEF Appendix A, 6.6): the question, the options, the answer, who decided, and what the record carries for a decision ticket or for a question of the grill's design tree. Every entry of research/DECISIONS.md is one, open (answer null) until it is settled.",
  "type": "object",
  "required": ["question", "options", "answer", "rationale", "confidence", "decided_by", "reversible", "timestamp"],
  "additionalProperties": false,
  "properties": {
    "id": {"type": "string", "pattern": "^Q[1-9][0-9]*$", "description": "a question of the grill's design tree; a record for a decision ticket carries ticket instead"},
    "ticket": {"type": ["integer", "null"], "minimum": 1},
    "question": {"type": "string", "pattern": "\\S"},
    "options": {"type": "array", "items": {"type": "string"}},
    "recommended": {"type": ["string", "null"]},
    "evidence": {"type": "array", "items": {"type": "string"}},
    "requires": {"type": "array", "items": {"type": "string", "pattern": "^Q[1-9][0-9]*$"}, "description": "the questions whose answers this one waits on; a tier asks it only once they are settled"},
    "blocking": {"enum": ["subgraph", "all", null]},
    "human_only": {"type": "boolean"},
    "tier": {"type": ["integer", "null"], "minimum": 1, "description": "the grill tier that first asked it; null until a tier does"},
    "supersedes": {"type": ["string", "null"], "pattern": "^Q[1-9][0-9]*$", "description": "the settled question this record answers again"},
    "answer": {"type": ["string", "null"]},
    "rationale": {"type": ["string", "null"]},
    "confidence": {"type": ["number", "null"], "minimum": 0, "maximum": 1},
    "decided_by": {"enum": ["human", "decider", "conductor", null], "description": "conductor on a decision ticket the conductor closed: the ask of decision 15 superseded, or answered at its timeout"},
    "model": {"type": ["string", "null"], "description": "the model the decider's session ran on (decision 15); absent on an answer no model gave"},
    "fallback_from": {"enum": ["fable", null], "description": "fable when the decider ran on Opus while Fable's weekly window was spent (decision 15)"},
    "reversible": {"type": "boolean"},
    "timestamp": {"type": ["string", "null"]}
  }
}
